{
  "$schema": "./schema-validation.json",

  "orgId": "vkt",
  "authorityId": "VKT:Authority:VKT_ID",

  "supportEmail": "post@vkt.no",

  "fylkeskommune": {
    "logoSrc": "/vestfold_fylkeskommune.svg",
    "logoSrcDark": "/vestfold_fylkeskommune.svg",
    "name": "Vestfold fylkeskommune"
  },

  "featureConfig": {
    "enableShowTripPatternPrice": false,
    "forceTheme": "light"
  },

  "urls": {
    "privacyDeclarationUrl": {
      "default": "https://www.vkt.no/vilkaar-og-personvern/personvern/"
    },

    "accessibilityStatementUrl": {
      "default": "https://www.vkt.no/om-oss/tilgjengelighetserklaering/"
    },

    "supportUrl": {
      "default": "https://www.vkt.no/om-oss/kontakt-oss/",
      "en-US": "https://www.vkt.no/english/"
    },
    "homePageUrl": {
      "name": "vkt.no",
      "href": "https://vkt.no"
    },
    "ticketInfoUrl": {
      "en-US": "https://www.vkt.no/english/",
      "nn": "https://www.vkt.no/reise/billetter-og-priser/",
      "default": "https://www.vkt.no/reise/billetter-og-priser/"
    },
    "purchaseTicketUrl": {
      "en-US": "https://www.vkt.no/english/",
      "nn": "https://www.vkt.no/reise/billetter-og-priser/",
      "default": "https://www.vkt.no/reise/billetter-og-priser/"
    },
    "sitemapUrls": {
      "dev": "http://localhost:3000",
      "staging": "https://vkt-staging.planner-web.mittatb.no/",
      "prod": "https://reise.vkt.no/"
    },
    "androidAppUrl": {
      "default": "https://play.google.com/store/apps/details?id=no.vfk.travelassistant"
    },
    "iosAppUrl": {
      "default": "https://apps.apple.com/no/app/vkt/id6673909689"
    }
  },
  "journeyApiConfigurations": {
    "waitReluctance": 1.0,
    "walkingReluctance": 4.0,
    "transferPenalty": 0,
    "defaultTransferSlack": 0
  },
  "embed": {
    "allowedOrigins": ["https://vkt.no", "https://*.vkt.no"]
  }
}
