{
  "$schema": "./schema-validation.json",

  "orgId": "fram",
  "authorityId": "MOR:Authority:MOR",

  "supportEmail": "fram@mrfylke.no",

  "fylkeskommune": {
    "logoSrc": "/fram_mor_fylkeskommune.svg",
    "logoSrcDark": "/fram_mor_fylkeskommune_dark.svg",
    "name": "Møre og Romsdal fylkeskommune"
  },

  "featureConfig": {
    "replaceTitleWithLogoInHeader": true,
    "enableShowTripPatternPrice": true,
    "disableBoatComboPriceSearch": false
  },

  "urls": {
    "privacyDeclarationUrl": {
      "default": "https://frammr.no/personvern"
    },

    "accessibilityStatementUrl": {
      "default": "https://uustatus.no/nb/erklaringer/publisert/7d09e41a-8b28-4bc9-b5d2-a6bc8432f2cf"
    },

    "supportUrl": {
      "default": "https://reise.frammr.no/contact",
      "en-US": "https://reise.frammr.no/contact"
    },
    "homePageUrl": {
      "name": "frammr.no",
      "href": "https://www.frammr.no/"
    },
    "ticketInfoUrl": {
      "en-US": "https://frammr.no/billettar/billettar-og-prisar/?sprak=3",
      "nn": "https://frammr.no/billettar/billettar-og-prisar/?sprak=11",
      "default": "https://frammr.no/billettar/billettar-og-prisar/"
    },
    "purchaseTicketUrl": {
      "en-US": "https://frammr.no/tickets/how-to-buy-a-ticket/?sprak=3",
      "nn": "https://frammr.no/billettar/slik-kjoper-du-billett/",
      "default": "https://frammr.no/billettar/slik-kjoper-du-billett/"
    },
    "sitemapUrls": {
      "dev": "http://localhost:3000",
      "staging": "https://fram-staging.planner-web.mittatb.no/",
      "prod": "https://reise.frammr.no/"
    },
    "androidAppUrl": {
      "default": "https://play.google.com/store/apps/details?id=no.mrfylke.fram.production"
    },
    "iosAppUrl": {
      "default": "https://apps.apple.com/no/app/fram/id6447612651"
    }
  },
  "journeyApiConfigurations": {
    "waitReluctance": 1.0,
    "walkingReluctance": 4.0,
    "transferPenalty": 0,
    "defaultTransferSlack": 120
  },
  "embed": {
    "allowedOrigins": ["https://frammr.no", "https://*.frammr.no"]
  }
}
