{
  "$schema": "./schema-validation.json",

  "orgId": "farte",
  "authorityId": "TEL:Authority:TFK_ID",

  "supportEmail": "farte@telemarkfylke.no ",

  "fylkeskommune": {
    "logoSrc": "/telemark_fylkeskommune.svg",
    "logoSrcDark": "/telemark_fylkeskommune.svg",
    "name": "Telemark fylkeskommune"
  },

  "featureConfig": {
    "forceTheme": "light",
    "enableShowTripPatternPrice": false
  },

  "urls": {
    "privacyDeclarationUrl": {
      "default": "https://www.farte.no/vilkaar-og-personvern/"
    },

    "accessibilityStatementUrl": {
      "default": "https://www.farte.no/om-farte/tilgjengelighetserklaering/"
    },

    "supportUrl": {
      "default": "https://www.farte.no/kundeservice/",
      "en-US": "https://www.farte.no/english/"
    },
    "homePageUrl": {
      "name": "farte.no",
      "href": "https://www.farte.no/"
    },
    "ticketInfoUrl": {
      "en-US": "https://www.farte.no/english/",
      "nn": "https://www.farte.no/reise/billetter-og-priser/",
      "default": "https://www.farte.no/reise/billetter-og-priser/"
    },
    "purchaseTicketUrl": {
      "en-US": "https://www.farte.no/english/",
      "nn": "https://www.farte.no/reise/billetter-og-priser/",
      "default": "https://www.farte.no/reise/billetter-og-priser/"
    },
    "sitemapUrls": {
      "dev": "http://localhost:3000",
      "staging": "https://farte-staging.planner-web.mittatb.no/",
      "prod": "https://reise.farte.no/"
    },
    "androidAppUrl": {
      "default": "https://play.google.com/store/apps/details?id=no.tfk.travelassistant"
    },
    "iosAppUrl": {
      "default": "https://apps.apple.com/no/app/farte/id6479402566"
    }
  },
  "journeyApiConfigurations": {
    "waitReluctance": 1.0,
    "walkingReluctance": 4.0,
    "transferPenalty": 0,
    "defaultTransferSlack": 0
  },
  "embed": {
    "allowedOrigins": ["https://farte.no", "https://*.farte.no"]
  }
}
