{
  "$schema": "./schema-validation.json",
  "orgId": "nfk",
  "authorityId": "NOR:Authority:12",

  "supportEmail": "sentrumsterminalen@boreal.no",

  "fylkeskommune": {
    "logoSrc": "/nfk_fylkeskommune.svg",
    "logoSrcDark": "/nfk_fylkeskommune_dark.svg",
    "name": "Nordland fylkeskommune"
  },

  "featureConfig": {
    "enableShowTripPatternPrice": true,
    "disableBoatComboPriceSearch": false
  },

  "urls": {
    "privacyDeclarationUrl": {
      "default": "https://www.reisnordland.no/personvern-og-cookies"
    },

    "accessibilityStatementUrl": {
      "default": "https://uustatus.no/nb/erklaringer/publisert/ae5bc315-272a-469e-b4cb-8ba5164ea988"
    },

    "supportUrl": {
      "default": "https://www.reisnordland.no/kontaktskjema",
      "en-US": "https://www.reisnordland.com/contact-us"
    },

    "instagramLink": "https://www.instagram.com/reisnordland",
    "facebookLink": "https://www.facebook.com/ReisNordland",
    "homePageUrl": {
      "name": "reisnordland.no",
      "href": "https://www.reisnordland.no/"
    },
    "ticketInfoUrl": {
      "en-US": "https://www.reisnordland.no/priser-pa-buss",
      "no": "https://www.reisnordland.no/priser-pa-buss",
      "default": "https://www.reisnordland.no/priser-pa-buss"
    },
    "purchaseTicketUrl": {
      "en-US": "https://www.reisnordland.no/kjop-bussbillett",
      "no": "https://www.reisnordland.no/kjop-bussbillett",
      "default": "https://www.reisnordland.no/kjop-bussbillett"
    },
    "sitemapUrls": {
      "dev": "http://localhost:3000",
      "staging": "https://nfk-staging.planner-web.mittatb.no/",
      "prod": "https://reise.reisnordland.no/"
    },
    "androidAppUrl": {
      "default": "https://play.google.com/store/apps/details?id=no.reisnordland.reis.production"
    },
    "iosAppUrl": {
      "default": "https://apps.apple.com/no/app/reis/id1574137854"
    }
  },
  "journeyApiConfigurations": {
    "waitReluctance": 1.0,
    "walkingReluctance": 4.0,
    "transferPenalty": 0,
    "defaultTransferSlack": 0
  },
  "embed": {
    "allowedOrigins": ["https://reisnordland.no", "https://*.reisnordland.no"]
  },
  "appLinks": {
    "staging": {
      "iosAppIds": [
        "7U3L7LAA9V.no.reisnordland.reis.staging",
        "7U3L7LAA9V.no.reisnordland.reis.debug"
      ],
      "androidApps": [
        {
          "packageName": "no.reisnordland.reis.staging",
          "sha256CertFingerprints": [
            "3E:3F:5B:F0:C1:BD:3B:C9:2B:32:6A:48:D1:65:11:4D:BD:9E:F2:D1:35:F4:46:1F:00:E4:7E:D6:9F:7D:88:BD"
          ]
        },
        {
          "packageName": "no.reisnordland.reis.debug",
          "sha256CertFingerprints": [
            "FA:C6:17:45:DC:09:03:78:6F:B9:ED:E6:2A:96:2B:39:9F:73:48:F0:BB:6F:89:9B:83:32:66:75:91:03:3B:9C"
          ]
        }
      ]
    }
  }
}
