{
  "$schema": "./schema-validation.json",
  "orgId": "atb",
  "authorityId": "ATB:Authority:2",

  "supportEmail": "kundeservice@atb.no",

  "fylkeskommune": {
    "logoSrc": "/trl_fylkeskommune.svg",
    "logoSrcDark": "/trl_fylkeskommune_dark.svg",
    "name": "Trøndelag fylkeskommune"
  },

  "featureConfig": {
    "enableShowTripPatternPrice": true,
    "disableBoatComboPriceSearch": true
  },

  "urls": {
    "privacyDeclarationUrl": {
      "default": "https://www.atb.no/vilkar/personvernerklaering-for-kundetjenester/"
    },

    "accessibilityStatementUrl": {
      "default": "https://uustatus.no/nb/erklaringer/publisert/2eb632a6-8e02-4d83-bdc3-3d9901f079bd"
    },

    "supportUrl": {
      "default": "https://atb.no/kundeservice/",
      "en-US": "https://www.atb.no/en/customer-service/"
    },
    "facebookLink": "https://www.facebook.com/atb.no/",
    "instagramLink": "https://www.instagram.com/atb_no/",
    "twitterLink": "https://twitter.com/atb_no",
    "homePageUrl": {
      "name": "atb.no",
      "href": "https://atb.no/"
    },
    "ticketInfoUrl": {
      "en-US": "https://www.atb.no/en/fares/",
      "no": "https://www.atb.no/priser/",
      "default": "https://www.atb.no/priser/"
    },
    "sitemapUrls": {
      "dev": "http://localhost:3000",
      "staging": "https://atb-staging.planner-web.mittatb.no/",
      "prod": "https://reise.atb.no/"
    },
    "purchaseTicketUrl": {
      "en-US": "https://www.atb.no/en/ticket/",
      "no": "https://www.atb.no/billett/",
      "default": "https://www.atb.no/billett/"
    },
    "androidAppUrl": {
      "default": "https://play.google.com/store/apps/details?id=no.mittatb.store"
    },
    "iosAppUrl": {
      "default": "https://apps.apple.com/us/app/atb/id1502395251"
    }
  },
  "journeyApiConfigurations": {
    "waitReluctance": 1.0,
    "walkingReluctance": 4.0,
    "transferPenalty": 0,
    "defaultTransferSlack": 120
  },
  "appLinks": {
    "staging": {
      "iosAppIds": [
        "CSV447Q97L.no.mittatb.staging",
        "CSV447Q97L.no.mittatb.debug"
      ],
      "androidApps": [
        {
          "packageName": "no.mittatb.staging",
          "sha256CertFingerprints": [
            "B1:41:B6:A9:A2:42:18:1A:68:96:45:15:F1:E9:86:F6:A1:D2:09:AF:7A:DD:BA:B2:B2:25:CA:5A:DD:C3:5F:B4"
          ]
        },
        {
          "packageName": "no.mittatb.debug",
          "sha256CertFingerprints": [
            "FA:C6:17:45:DC:09:03:78:6F:B9:ED:E6:2A:96:2B:39:9F:73:48:F0:BB:6F:89:9B:83:32:66:75:91:03:3B:9C"
          ]
        }
      ]
    }
  }
}
